{
  "$schema": "http://json-schema.org/draft-07/schema#",
  "$id": "security-vulnerability-watch.schema.json",
  "title": "AgentTeams Security Vulnerability Watch",
  "description": "Generator-owned live/cached security intelligence snapshot (CISA KEV, FIRST EPSS, NVD CVSS, OSV.dev, static OWASP LLM Top 10). The vulnerabilities[] item shape below is the canonical (write) shape this module has always persisted -- an offline/stale-cache read hands these same records back unchanged, never a differently-named live-API shape. See references/plans/security-vuln-cache-normalization.plan.md for why this schema exists and references/plans/security-vuln-cache-json-schema.plan.md for how it's enforced.",
  "type": "object",
  "additionalProperties": false,
  "required": ["vulnerabilities"],
  "properties": {
    "generated_at": { "type": "string", "minLength": 1 },
    "sources": {
      "type": "array",
      "items": {
        "type": "object",
        "additionalProperties": true,
        "required": ["name", "url", "status"],
        "properties": {
          "name": { "type": "string" },
          "url": { "type": "string" },
          "status": { "type": "string" }
        }
      }
    },
    "vulnerabilities": {
      "type": "array",
      "items": {
        "type": "object",
        "additionalProperties": false,
        "required": ["cve", "vendor", "product", "name", "date_added"],
        "properties": {
          "cve": { "type": "string" },
          "vendor": { "type": "string" },
          "product": { "type": "string" },
          "name": { "type": "string" },
          "date_added": { "type": "string" },
          "known_ransomware_campaign_use": { "type": "string" },
          "required_action": { "type": "string" },
          "epss": { "type": "string" },
          "epss_percentile": { "type": "string" },
          "cvss_score": { "type": "string" },
          "cvss_severity": { "type": "string" },
          "cvss_version": { "type": "string" }
        }
      }
    },
    "osv_packages": {
      "type": "array",
      "items": {
        "type": "object",
        "additionalProperties": false,
        "required": ["package", "ecosystem", "vuln_count", "top_ids"],
        "properties": {
          "package": { "type": "string" },
          "ecosystem": { "type": "string" },
          "vuln_count": { "type": "integer" },
          "top_ids": { "type": "array", "items": { "type": "string" } }
        }
      }
    },
    "control_evidence": {
      "type": "array",
      "items": { "type": "object" }
    },
    "freshness": {
      "type": "object",
      "additionalProperties": false,
      "required": ["status", "age_hours", "ttl_hours", "used_stale_cache", "offline"],
      "properties": {
        "status": { "enum": ["fresh", "stale", "unknown"] },
        "age_hours": { "type": "string" },
        "ttl_hours": { "type": "integer" },
        "used_stale_cache": { "type": "boolean" },
        "cache_corrupt": { "type": "boolean" },
        "offline": { "type": "boolean" }
      }
    },
    "llm_threats": {
      "type": "array",
      "items": { "type": "object" }
    },
    "llm_security_references": {
      "type": "array",
      "items": { "type": "object" }
    },
    "methodology": { "type": "object" }
  }
}
