{
  "generated_at": "2026-08-17T12:03:10Z",
  "sources": [
    {
      "name": "CISA KEV",
      "url": "https://www.cisa.gov/sites/default/files/feeds/known_exploited_vulnerabilities.json",
      "status": "ok",
      "catalogVersion": "2026.08.14",
      "count": 1665
    },
    {
      "name": "MITRE CVE",
      "url": "https://cveawg.mitre.org/api/cve/",
      "status": "metadata_only"
    },
    {
      "name": "FIRST EPSS",
      "url": "https://api.first.org/data/v1/epss",
      "status": "ok",
      "count": 15
    },
    {
      "name": "NVD (NIST)",
      "url": "https://services.nvd.nist.gov/rest/json/cves/2.0",
      "status": "ok",
      "count": 5
    },
    {
      "name": "OSV.dev",
      "url": "https://api.osv.dev/v1/querybatch",
      "status": "skipped"
    },
    {
      "name": "OWASP LLM Top 10",
      "url": "https://owasp.org/www-project-top-10-for-large-language-model-applications/",
      "status": "static"
    },
    {
      "name": "MITRE ATLAS",
      "url": "https://atlas.mitre.org/",
      "status": "static"
    },
    {
      "name": "MITRE CWE",
      "url": "https://cwe.mitre.org/",
      "status": "static"
    },
    {
      "name": "Snyk Vulnerability DB",
      "url": "https://security.snyk.io/",
      "status": "static"
    },
    {
      "name": "npm audit docs",
      "url": "https://docs.npmjs.com/auditing-package-dependencies-for-security-vulnerabilities",
      "status": "static"
    }
  ],
  "vulnerabilities": [
    {
      "cve": "CVE-2026-20349",
      "vendor": "Cisco",
      "product": "Secure Firewall Adaptive Security Appliance (ASA) and Secure Firewall Threat Defense (FTD) ",
      "name": "Cisco Secure Firewall Adaptive Security Appliance (ASA) and Secure Firewall Threat Defense (FTD) Heap Inspection Vulnerability",
      "date_added": "2026-08-11",
      "known_ransomware_campaign_use": "Unknown",
      "required_action": "Apply mitigations in accordance with vendor instructions, ensuring compliance with CISA\u2019s BOD 26-04 Prioritizing Security Updates Based on Risk (see URL in Notes) guidance and CISA\u2019s \u201cForensics Triage Requirements\u201d (see URL in Notes). Follow applicable BOD 26-04 guidance for cloud services or discontinue use of the product if mitigations are unavailable. Stakeholders are responsible for evaluating each asset's internet exposure and ensuring adherence to BOD 26-04 patching guidelines.",
      "epss": "0.008740000",
      "epss_percentile": "0.559360000",
      "cvss_score": "8.6",
      "cvss_severity": "HIGH",
      "cvss_version": "3.1"
    },
    {
      "cve": "CVE-2026-68820",
      "vendor": "Microsoft",
      "product": "Windows Ancillary Function Driver for WinSock ",
      "name": "Microsoft Windows Ancillary Function Driver for WinSock Use-After-Free Vulnerability",
      "date_added": "2026-08-11",
      "known_ransomware_campaign_use": "Unknown",
      "required_action": "Apply mitigations in accordance with vendor instructions, ensuring compliance with CISA\u2019s BOD 26-04 Prioritizing Security Updates Based on Risk (see URL in Notes) guidance and CISA\u2019s \u201cForensics Triage Requirements\u201d (see URL in Notes). Follow applicable BOD 26-04 guidance for cloud services or discontinue use of the product if mitigations are unavailable. Stakeholders are responsible for evaluating each asset's internet exposure and ensuring adherence to BOD 26-04 patching guidelines.",
      "epss": "0.003320000",
      "epss_percentile": "0.261490000",
      "cvss_score": "7.0",
      "cvss_severity": "HIGH",
      "cvss_version": "3.1"
    },
    {
      "cve": "CVE-2026-72898",
      "vendor": "Metabase",
      "product": "Metabase",
      "name": "Metabase SQL Injection Vulnerability",
      "date_added": "2026-08-11",
      "known_ransomware_campaign_use": "Unknown",
      "required_action": "Apply mitigations in accordance with vendor instructions, ensuring compliance with CISA\u2019s BOD 26-04 Prioritizing Security Updates Based on Risk (see URL in Notes) guidance and CISA\u2019s \u201cForensics Triage Requirements\u201d (see URL in Notes). Follow applicable BOD 26-04 guidance for cloud services or discontinue use of the product if mitigations are unavailable. Stakeholders are responsible for evaluating each asset's internet exposure and ensuring adherence to BOD 26-04 patching guidelines.",
      "epss": "0.104000000",
      "epss_percentile": "0.953300000",
      "cvss_score": "10.0",
      "cvss_severity": "CRITICAL",
      "cvss_version": "3.1"
    },
    {
      "cve": "CVE-2026-8037",
      "vendor": "Progress",
      "product": "LoadMaster",
      "name": "Progress LoadMaster Command Injection Vulnerability",
      "date_added": "2026-08-07",
      "known_ransomware_campaign_use": "Unknown",
      "required_action": "Apply mitigations in accordance with vendor instructions, ensuring compliance with CISA\u2019s BOD 26-04 Prioritizing Security Updates Based on Risk (see URL in Notes) guidance and CISA\u2019s \u201cForensics Triage Requirements\u201d (see URL in Notes). Follow applicable BOD 26-04 guidance for cloud services or discontinue use of the product if mitigations are unavailable. Stakeholders are responsible for evaluating each asset's internet exposure and ensuring adherence to BOD 26-04 patching guidelines.",
      "epss": "0.993110000",
      "epss_percentile": "0.999360000",
      "cvss_score": "9.6",
      "cvss_severity": "CRITICAL",
      "cvss_version": "3.1"
    },
    {
      "cve": "CVE-2026-63077",
      "vendor": "JetBrains",
      "product": "TeamCity",
      "name": "JetBrains TeamCity Deserialization of Untrusted Data Vulnerability",
      "date_added": "2026-08-05",
      "known_ransomware_campaign_use": "Unknown",
      "required_action": "Apply mitigations in accordance with vendor instructions, ensuring compliance with CISA\u2019s BOD 26-04 Prioritizing Security Updates Based on Risk (see URL in Notes) guidance and CISA\u2019s \u201cForensics Triage Requirements\u201d (see URL in Notes). Follow applicable BOD 26-04 guidance for cloud services or discontinue use of the product if mitigations are unavailable. Stakeholders are responsible for evaluating each asset's internet exposure and ensuring adherence to BOD 26-04 patching guidelines.",
      "epss": "0.107220000",
      "epss_percentile": "0.954310000",
      "cvss_score": "9.8",
      "cvss_severity": "CRITICAL",
      "cvss_version": "3.1"
    },
    {
      "cve": "CVE-2026-18556",
      "vendor": "N-able",
      "product": "N-central",
      "name": "N-able N-central Authentication Bypass Using an Alternate Path or Channel Vulnerability",
      "date_added": "2026-08-04",
      "known_ransomware_campaign_use": "Unknown",
      "required_action": "Apply mitigations in accordance with vendor instructions, ensuring compliance with CISA\u2019s BOD 26-04 Prioritizing Security Updates Based on Risk (see URL in Notes) guidance and CISA\u2019s \u201cForensics Triage Requirements\u201d (see URL in Notes). Follow applicable BOD 26-04 guidance for cloud services or discontinue use of the product if mitigations are unavailable. Stakeholders are responsible for evaluating each asset's internet exposure and ensuring adherence to BOD 26-04 patching guidelines.",
      "epss": "0.004920000",
      "epss_percentile": "0.401120000"
    },
    {
      "cve": "CVE-2026-34486",
      "vendor": "Apache",
      "product": "Tomcat",
      "name": "Apache Tomcat Missing Encryption of Sensitive Data Vulnerability",
      "date_added": "2026-08-04",
      "known_ransomware_campaign_use": "Unknown",
      "required_action": "Apply mitigations in accordance with vendor instructions, ensuring compliance with CISA\u2019s BOD 26-04 Prioritizing Security Updates Based on Risk (see URL in Notes) guidance and CISA\u2019s \u201cForensics Triage Requirements\u201d (see URL in Notes). Follow applicable BOD 26-04 guidance for cloud services or discontinue use of the product if mitigations are unavailable. Stakeholders are responsible for evaluating each asset's internet exposure and ensuring adherence to BOD 26-04 patching guidelines.",
      "epss": "0.829330000",
      "epss_percentile": "0.996460000"
    },
    {
      "cve": "CVE-2026-9198",
      "vendor": "IBM",
      "product": "Langflow",
      "name": "IBM Langflow Code Injection Vulnerability",
      "date_added": "2026-08-04",
      "known_ransomware_campaign_use": "Unknown",
      "required_action": "Apply mitigations in accordance with vendor instructions, ensuring compliance with CISA\u2019s BOD 26-04 Prioritizing Security Updates Based on Risk (see URL in Notes) guidance and CISA\u2019s \u201cForensics Triage Requirements\u201d (see URL in Notes). Follow applicable BOD 26-04 guidance for cloud services or discontinue use of the product if mitigations are unavailable. Stakeholders are responsible for evaluating each asset's internet exposure and ensuring adherence to BOD 26-04 patching guidelines.",
      "epss": "0.173520000",
      "epss_percentile": "0.968490000"
    },
    {
      "cve": "CVE-2026-18577",
      "vendor": "N-able",
      "product": "N-central",
      "name": "N-able N-central Authentication Bypass Using an Alternate Path or Channel Vulnerability",
      "date_added": "2026-08-03",
      "known_ransomware_campaign_use": "Unknown",
      "required_action": "Apply mitigations in accordance with vendor instructions, ensuring compliance with CISA\u2019s BOD 26-04 Prioritizing Security Updates Based on Risk (see URL in Notes) guidance and CISA\u2019s \u201cForensics Triage Requirements\u201d (see URL in Notes). Follow applicable BOD 26-04 guidance for cloud services or discontinue use of the product if mitigations are unavailable. Stakeholders are responsible for evaluating each asset's internet exposure and ensuring adherence to BOD 26-04 patching guidelines.",
      "epss": "0.041030000",
      "epss_percentile": "0.898870000"
    },
    {
      "cve": "CVE-2026-20316",